{
  "scenario_id": "SCN-005",
  "persona_name": "TechBoost Solutions",
  "pan": "SIMTB0005S",
  "gstin": "27SIMTB0005S1Z9",
  "business_type": "Startup",
  "expected_credit_outcome": "APPROVED",
  "fhc_score_target": 79,
  "ckyc_status": "CLEAN",
  "gst_profile": "HIGH_GROWTH",
  "aa_cash_flow_profile": "STRONG_CASHFLOW",
  "epfo_status": "GROWING_WORKFORCE",
  "mca_status": "ACTIVE_COMPLIANT",
  "rbi_fraud_status": "CLEAN",
  "explainability_tags": ["GST_GROWTH_STRONG", "DSCR_OK"],
  "mudra_eligible": false,
  "scheme_tags": [],
  "kcc_eligible": false,
  "ecgc_coverage": false
}
